category,question
Management Commentary,What strategic priorities did CEO Laxman Narasimhan highlight during the November????023 earnings call?
Management Commentary,"According to management, how is the Reinvention plan impacting partner experience in U.S. stores?"
Management Commentary,What comments did CFO Rachel Ruggeri make regarding margin expansion drivers in fiscal??023?
Management Commentary,How did management describe the performance of the China market in Q4??023?
Management Commentary,What did executives say about the momentum of cold beverages in the U.S. business?
Management Commentary,How did leadership characterize Starbucks Rewards growth in fiscal??023?
Management Commentary,"What rationale did management provide for establishing the Environmental, Partner and Community Impact board committee?"
Management Commentary,"According to the 8?_, what reasons did Starbucks give for record revenue in Q4??023?"
Management Commentary,How did management frame their capital allocation priorities for fiscal??024?
Management Commentary,What cultural values did the CEO emphasize in his letter to shareholders?
Earnings result/Financials,What was Starbucks??total net revenue for Q4??023?
Earnings result/Financials,How much did net earnings attributable to Starbucks increase year?_ver?_ear in Q4??023?
Earnings result/Financials,What was Starbucks??consolidated operating margin in Q4??023?
Earnings result/Financials,How many basis points did operating margin expand for the full year 2023?
Earnings result/Financials,What was diluted EPS for fiscal??023 on a non?_AAP basis?
Earnings result/Financials,How much cash and cash equivalents did Starbucks report as of July????023?
Earnings result/Financials,What percentage of total net revenues came from company?_perated stores in fiscal??023?
Earnings result/Financials,What amount of dividends did Starbucks pay during the first three quarters of 2023?
Earnings result/Financials,How much long?_erm debt was outstanding at July????023?
Earnings result/Financials,"What were the segment revenue contributions for North America, International, and Channel Development in fiscal??023?"
Guidance,What revenue growth range did Starbucks project for fiscal??024?
Guidance,What store count does Starbucks aim to reach in China by 2025?
Guidance,"According to guidance, what annual net new store growth rate is expected globally?"
Guidance,What is the company?_ long?_erm EPS growth target shared on the earnings call?
Guidance,Do Starbucks provide guidance on its operating margin and cost structure expectations for the upcoming period?
Guidance,What operating margin range did management forecast for FY??024?
Guidance,How is Starbucks guiding for capital expenditures in FY??024?
Guidance,What did Starbucks indicate about future dividend policy in its outlook?
Guidance,How much efficiency savings does Starbucks expect from Reinvention initiatives in 2024?
Guidance,What is Starbucks??expectation for comparable store sales growth in the U.S. in 2024?
Operating metric,How many company?_perated stores did Starbucks have worldwide at the end of fiscal??023?
Operating metric,"How is store traffic and transaction frequency tracked, and how does it impact Starbucks' financial forecasts and growth projections?"
Operating metric,How many 90?_ay active Starbucks Rewards members were reported in the U.S. in Q4??023?
Operating metric,What percentage of U.S. sales were attributable to Starbucks Rewards members in Q4??023?
Operating metric,How many net new stores did Starbucks open in China during Q4??023?
Operating metric,What was the beverage-to-food sales mix in company?_perated stores in fiscal??023?
Operating metric,How many licensed stores did Starbucks operate globally as of October????023?
Operating metric,What was the average ticket growth percentage in Q4??023?
Operating metric,"How many Mobile Order & Pay transactions does Starbucks process per day in the U.S., according to management commentary?"
Operating metric,What is the reported global market share of ready?_o?_rink coffee for Starbucks?
Analyst Q&A,What major risks were analysts focused on during the Q&A?
Analyst Q&A,What question was given by analysts about margin pressure in China during analyst Q&A?
Analyst Q&A,What concerns did analysts raise regarding labor union activity?
Analyst Q&A,What commentary was provided regarding pricing elasticity in the U.S. market?
Analyst Q&A,What were the key points of discussion among analysts regarding commodity prices?
Analyst Q&A,What response was given to inquiries about capital returns versus reinvestment priorities?
Analyst Q&A,How did management characterize competitive dynamics with McDonald?_ and Dunkin??
Analyst Q&A,What answers were given about progress on Clover Vertica installations?
Analyst Q&A,How did leadership respond to analyst questions about AI and personalization initiatives?
Analyst Q&A,How did analysts frame their questions about the performance of competitors?
Investor Sentiment,Which key themes did investors focus on following Starbucks??Q4??023 earnings release?
Investor Sentiment,How did Starbucks??share price react on the day after the earnings announcement?
Investor Sentiment,"According to management, what aspects of the business are resonating most with long?_erm shareholders?"
Investor Sentiment,What concerns have investors expressed about Starbucks??exposure to China?
Investor Sentiment,How are investors interpreting Starbucks??Reinvention capital investments?
Investor Sentiment,What feedback has Starbucks received from ESG?_ocused investors regarding its new board committee?
Investor Sentiment,How does management gauge investor appetite for further share repurchases?
Investor Sentiment,What sentiment indicators suggest confidence in Starbucks??digital growth strategy?
Investor Sentiment,How do analysts characterize Starbucks??valuation relative to its historical average?
Investor Sentiment,What is the consensus investor view on Starbucks??ability to maintain premium pricing?
Industry & Market,What is Starbucks??estimated share of the U.S. specialty coffee shop market?
Industry & Market,How is Starbucks positioning itself to capture growth in ready?_o?_rink coffee globally?
Industry & Market,What competitive advantage does management cite against independent coffee shops?
Industry & Market,How is the company leveraging partnerships like Nestlé to expand its at?_ome coffee presence?
Industry & Market,"According to the 10?_, what trends are driving increased demand for cold beverages?"
Industry & Market,How is Starbucks responding to the rise of delivery?_entric cafe formats?
Industry & Market,What market opportunity does Starbucks see in under?_enetrated U.S. suburban trade areas?
Industry & Market,How is Starbucks competing with convenience stores for beverage occasions?
Industry & Market,What strategies is Starbucks using to deepen market penetration in Tier?? and Tier?? Chinese cities?
Industry & Market,How does Starbucks assess the competitive landscape for plant?_ased beverages?
Risks & Challenges,"According to the 10?_, what are the principal risks related to commodity coffee price fluctuations?"
Risks & Challenges,How could ongoing unionization efforts impact Starbucks??labor costs?
Risks & Challenges,What cybersecurity risks does Starbucks identify in its risk factors?
Risks & Challenges,How might global geopolitical tensions affect Starbucks??supply chain?
Risks & Challenges,What litigation contingencies were disclosed in the latest 10?_?
Risks & Challenges,What strategies are in place to mitigate the risk of losing market share due to changing consumer preferences?
Risks & Challenges,What challenges does management foresee in achieving its 2030 sustainability targets?
Risks & Challenges,"What risks does Starbucks face in terms of digital transformation, particularly regarding its mobile app and online ordering systems?"
Risks & Challenges,What risk is posed by increased competition from specialty coffee chains in China?
Risks & Challenges,How could potential changes in U.S. tax law impact Starbucks??effective tax rate?
Macro & Economics,How is Starbucks management monitoring consumer spending trends amid macro uncertainty?
Macro & Economics,What impact did foreign currency translation have on revenue growth in fiscal??023?
Macro & Economics,How does Starbucks expect interest?_ate changes to influence capital costs?
Macro & Economics,How has wage inflation affected store operating expenses?
Macro & Economics,To what extent do tariffs on imported goods affect Starbucks' cost structure and sourcing strategy?
Macro & Economics,"In markets where real estate prices are rising sharply, how is the company managing its lease commitments?"
Macro & Economics,How did economic reopening trends contribute to comparable sales growth in Japan?
Macro & Economics,How does the company view the risk of recession in its key markets?
Macro & Economics,What commentary did Starbucks provide on unemployment levels??impact on labor availability?
Macro & Economics,How does Starbucks incorporate macroeconomic scenarios into its financial planning?
Compensation,What was the CEO pay ratio disclosed in the 2023 proxy statement?
Compensation,How does the executive compensation compare to that of peer companies?
Compensation,What percentage of executive incentive pay is tied to ESG metrics?
Compensation,How did Starbucks change its long?_erm incentive program for executives in 2023?
Compensation,What advisory vote frequency on executive compensation did the board recommend?
Compensation,How many shares were authorized under the Employee Stock Purchase Plan proposal?
Compensation,What proportion of director compensation is delivered in equity?
Compensation,How does Starbucks align partner wage increases with shareholder returns?
Compensation,What threshold performance metrics trigger annual cash bonuses for executives?
Compensation,What clawback provisions apply to Starbucks??executive compensation plans?